{
  "title": "Провєр своје розумјење",
  "generatedBy": "compile_pack",
  "generatedFrom": "reading-pack.md",
  "questions": [
    {
      "type": "single_choice",
      "question": "Что говори Магда Тымону умєсто послати јего в кут в магазину?",
      "answers": [
        "Иди в кут",
        "Ја потřебују објęтје",
        "Получиш плашчку",
        "Мы никогда вече не будем куповати"
      ],
      "correctIndex": 1,
      "explanation": "Она повтарја: \"Ја потřебују објęтје\" — и цхлапеч утишаје се."
    },
    {
      "type": "single_choice",
      "question": "Колико долговременных послєднице казни списује Магда?",
      "answers": [
        "Двє",
        "Четыри",
        "Шест",
        "Одину"
      ],
      "correctIndex": 1,
      "explanation": "Ресентимент, венг, ребеља и уступљење."
    },
    {
      "type": "single_choice",
      "question": "Что дєлаје Магда, когда Тымон пролива сок на ковр?",
      "answers": [
        "Кричит и отбирује јего играчку",
        "Вопросит \"Что мы можем счинити?\" и они разом мыјут",
        "Игнорује каľју",
        "Посыла јего в кут"
      ],
      "correctIndex": 1,
      "explanation": "Она показује послєдницу (вымыти), не казн."
    },
    {
      "type": "single_choice",
      "question": "Како Габрыш предлага назвати кут дома?",
      "answers": [
        "Казненны кут",
        "Спокојны кут",
        "Учебны кут",
        "Игралны кут"
      ],
      "correctIndex": 1,
      "explanation": "Габрыш говори: \"Спокојны кут — бо когда ја јест спокојны, ја мислим лучше\"."
    },
    {
      "type": "single_choice",
      "question": "Кторы јест главны закључек повєсти?",
      "answers": [
        "Дєти имајут быти послушне",
        "Идет о то, да бы дєти быле готове до живота — умєле владати својими емоцијами",
        "Казни сут најефективнєјше",
        "Сладке награды сут објазателне"
      ],
      "correctIndex": 1,
      "explanation": "Финачны част: \"Не идет о то, да бы дєти быле послушне. Идет о то, да бы оны быле готове до живота.\""
    }
  ]
}
