{
  "title": "Провєри разумєње",
  "generatedBy": "compile_pack",
  "generatedFrom": "reading-pack.md",
  "questions": [
    {
      "type": "single_choice",
      "question": "Ким јест Филиппо Бионди?",
      "answers": [
        "Кухар?",
        "Изследоватељ / научник при данных о",
        "Футболист",
        "Пилот"
      ],
      "correctIndex": 1,
      "explanation": "Др Филиппо Бионди работаје при данных и загадкє Сфинкса."
    },
    {
      "type": "single_choice",
      "question": "Какы споменик јавјаје се в концу?",
      "answers": [
        "Колосеум",
        "Великы Сфинкс в",
        "Еифелова вєжа",
        "Акропол?"
      ],
      "correctIndex": 1,
      "explanation": "Кончи се образом Великого Сфинкса на плато Гиза."
    },
    {
      "type": "single_choice",
      "question": "Что лежи на запад од Сфинкса?",
      "answers": [
        "Море?",
        "Пєсчаны холм, под ним нєчто",
        "Летишче",
        "Музеј"
      ],
      "correctIndex": 1,
      "explanation": "За Сфинксом лежи пєсчаны холм; под ним нєчто чека."
    },
    {
      "type": "single_choice",
      "question": "Каку метафору загадкы призываје нарратив?",
      "answers": [
        "Лабиринт Минотаура",
        "Загадку гречского",
        "Јаблко Неwтона?",
        "Само меч Дамоклеса"
      ],
      "correctIndex": 1,
      "explanation": "Сравњаје пытање с загадкоју гречского Сфинкса."
    },
    {
      "type": "single_choice",
      "question": "Что дела Бионди в концу сцены в работє?",
      "answers": [
        "Кричи на свој тим",
        "Затварја за собоју",
        "Уничтва данныје",
        "Емигрује?"
      ],
      "correctIndex": 1,
      "explanation": "Бионди затварја за собоју двери."
    }
  ]
}
