{
  "title": "Провєри разумєње",
  "generatedBy": "compile_pack",
  "generatedFrom": "reading-pack.md",
  "questions": [
    {
      "type": "single_choice",
      "question": "Кто јест главна особа?",
      "answers": [
        "Тренер футболовы",
        "Новинар в медијах",
        "Лекар с приватноју клиникоју",
        "Учитељ в великој гимназији"
      ],
      "correctIndex": 1,
      "explanation": "Медијна особа / Становскы."
    },
    {
      "type": "single_choice",
      "question": "Что остаје по награњу?",
      "answers": [
        "Множство фанов в великом студију",
        "План слєдујућего долгого сезона",
        "Договор с новым рекламодавцем",
        "Тишина и глубока самотност"
      ],
      "correctIndex": 3,
      "explanation": "Светла гаснут; остаје сам."
    },
    {
      "type": "single_choice",
      "question": "Что јест «скорупа»?",
      "answers": [
        "Маска успєха в медијах",
        "Стары семејны автомобил",
        "Ново лого цєлаго канала",
        "Билет на важны футбаловы матцх"
      ],
      "correctIndex": 0,
      "explanation": "Публицна маска успєха."
    },
    {
      "type": "single_choice",
      "question": "Како пытање остаје на концу?",
      "answers": [
        "Колико коштује та нова камера?",
        "Чи то всегда вредно было?",
        "Гдє јест свободны паркинг тут?",
        "Когда починаје се та допуст?"
      ],
      "correctIndex": 1,
      "explanation": "Чи вредно было."
    },
    {
      "type": "single_choice",
      "question": "Чего дотыче се повєст?",
      "answers": [
        "Цєн билетов на матцхи",
        "Цєны успєха и славы",
        "Таных летов авионом",
        "Абонамента телевизијнего"
      ],
      "correctIndex": 1,
      "explanation": "Цєна успєха и славы."
    }
  ]
}
