{
  "title": "Провєрте своје разумєње",
  "generatedBy": "compile_pack",
  "generatedFrom": "reading-pack.md",
  "questions": [
    {
      "type": "single_choice",
      "question": "Кто јесть госпожа Анна?",
      "answers": [
        "Учитељница читанија в предшколском класє",
        "Лекарка",
        "Директорка школы",
        "Авторка учебников"
      ],
      "correctIndex": 0,
      "explanation": "Учи читати в предшколском класє уж двадцат лет."
    },
    {
      "type": "single_choice",
      "question": "Что цхлапец говори о слоге „ма\"?",
      "answers": [
        "„Ем а\"",
        "„Ма-ма\"",
        "„А ем\"",
        "„Ма\" без съједињења"
      ],
      "correctIndex": 0,
      "explanation": "Нарываје литеры вмєсто съједињења јих в слог."
    },
    {
      "type": "single_choice",
      "question": "Зачему госпожа Анна говори, же цхлапец не читаје?",
      "answers": [
        "Познаје образкы из апликације",
        "Не знает алфавита",
        "Не ходи до школы",
        "Имаје дефект зренија"
      ],
      "correctIndex": 0,
      "explanation": "Апликација показује слова с образками — то асоцијација, не читаније."
    },
    {
      "type": "single_choice",
      "question": "Что мати измєњаје по разговору с госпожеју Анној?",
      "answers": [
        "Читаје ребенку книгы и тренирује слоги",
        "Купаје новыј таблет",
        "Записује сына на спорт",
        "Измєњаје школу"
      ],
      "correctIndex": 0,
      "explanation": "Чрез мєсеч мати читаје книгы и показује слоги — цхлапец начинаје читати."
    },
    {
      "type": "single_choice",
      "question": "Что госпожа Анна говори мати на концу?",
      "answers": [
        "Же то мати научила цхлапца читати",
        "Же апликација јесть достаточна",
        "Же ребенок не подходит к ученију",
        "Же вина јесть на школє"
      ],
      "correctIndex": 0,
      "explanation": "Говори: „То не ја. То Вы.\""
    }
  ]
}
